{
  "schema_version": "rca-assessment/answer/v1",
  "case_id": "RCA-EXT-001",
  "issue_focus": {
    "domain": "ACC",
    "phenomena": [
      "跟停前车静止车，车速65，刹车晚，有恐慌感"
    ],
    "target_roles": [
      "target.range",
      "target.speed",
      "cipv.selected_alias",
      "cipv.selection_range",
      "target_alias"
    ],
    "required_capabilities": [
      "ego.speed",
      "target.range",
      "target.speed",
      "cipv.selected_alias",
      "cipv.selection_range",
      "controller.request_accel",
      "actuator.response",
      "driver_override",
      "frame_id",
      "target_alias"
    ],
    "required_segments": [
      "intake_description",
      "decoded_case_metadata",
      "raw_signal_slice",
      "attachment_evidence"
    ]
  },
  "data_assessment": {
    "status": "insufficient_evidence",
    "relevant_topics": [
      "vehicle_can",
      "control_debug",
      "object_perception",
      "vehicle_signal_highfreq",
      "vehicle_signal_lowfreq",
      "planning_environment",
      "lane_2d",
      "lane_bev"
    ],
    "missing_requirements": [
      "raw MCAP signal slice",
      "attachment bodies or independently reviewed frame annotations",
      "private gold terminal label and causal graph",
      "higher-confidence time and entity alignment"
    ],
    "evidence_boundary": "The fixture contains de-identified case metadata and derived factual-check observations. It contains no raw MCAP slice, attachment body, private gold label, or independently reviewed causal conclusion."
  },
  "alignment": {
    "anchor": {
      "status": "provided",
      "time_s": 11.2,
      "alignment": "exact_match"
    },
    "windows": [
      {
        "kind": "factual_check_window",
        "check": "object_kinematics_consistency",
        "start_s": -3,
        "end_s": 1
      },
      {
        "kind": "factual_check_window",
        "check": "ego_longitudinal_oscillation",
        "start_s": -5,
        "end_s": 2
      },
      {
        "kind": "factual_check_window",
        "check": "acc_jerk_spec",
        "start_s": 6.2,
        "end_s": 13.2
      },
      {
        "kind": "factual_check_window",
        "check": "acc_heavy_decel_spec",
        "start_s": 6.2,
        "end_s": 13.2
      },
      {
        "kind": "factual_check_window",
        "check": "acc_abnormal_exit_spec",
        "start_s": 6.2,
        "end_s": 13.2
      },
      {
        "kind": "factual_check_window",
        "check": "acc_ooi_target_switch_cut_in",
        "start_s": 6.2,
        "end_s": 16.2
      },
      {
        "kind": "factual_check_window",
        "check": "acc_dai_reminder",
        "start_s": 0,
        "end_s": 26.2
      },
      {
        "kind": "factual_check_window",
        "check": "object_track_quality",
        "start_s": -3,
        "end_s": 1
      },
      {
        "kind": "provided_focus_window",
        "start_s": 8.2,
        "end_s": 12.2
      }
    ],
    "entity_bindings": [
      {
        "status": "not_adjudicated",
        "available_alias_signals": [
          "cipv.selected_alias",
          "target_alias"
        ]
      }
    ]
  },
  "measurements": [
    {
      "name": "object_kinematics_consistency",
      "observation": "observed",
      "window_s": [
        -3,
        1
      ],
      "numeric_value_available": false,
      "source": "factual_check_observations"
    },
    {
      "name": "ego_longitudinal_oscillation",
      "observation": "observed",
      "window_s": [
        -5,
        2
      ],
      "numeric_value_available": false,
      "source": "factual_check_observations"
    },
    {
      "name": "acc_jerk_spec",
      "observation": "observed",
      "window_s": [
        6.2,
        13.2
      ],
      "numeric_value_available": false,
      "source": "factual_check_observations"
    },
    {
      "name": "acc_heavy_decel_spec",
      "observation": "observed",
      "window_s": [
        6.2,
        13.2
      ],
      "numeric_value_available": false,
      "source": "factual_check_observations"
    },
    {
      "name": "acc_abnormal_exit_spec",
      "observation": "not_observed",
      "window_s": [
        6.2,
        13.2
      ],
      "numeric_value_available": false,
      "source": "factual_check_observations"
    },
    {
      "name": "acc_ooi_target_switch_cut_in",
      "observation": "not_observed",
      "window_s": [
        6.2,
        16.2
      ],
      "numeric_value_available": false,
      "source": "factual_check_observations"
    },
    {
      "name": "acc_dai_reminder",
      "observation": "not_observed",
      "window_s": [
        0,
        26.2
      ],
      "numeric_value_available": false,
      "source": "factual_check_observations"
    },
    {
      "name": "object_track_quality",
      "observation": "insufficient_fields",
      "window_s": [
        -3,
        1
      ],
      "numeric_value_available": false,
      "source": "factual_check_observations"
    }
  ],
  "evaluator_results": [
    {
      "evaluator": "object_kinematics_consistency",
      "pattern": "perception_object_kinematics_anomaly",
      "technical_domain": "PERCEPTION_OBJECT",
      "observation": "observed",
      "evidence_class": "deidentified_derived_observation",
      "causal_conclusion": false
    },
    {
      "evaluator": "ego_longitudinal_oscillation",
      "pattern": "ego_longitudinal_oscillation",
      "technical_domain": "CONTROL_LONGITUDINAL",
      "observation": "observed",
      "evidence_class": "deidentified_derived_observation",
      "causal_conclusion": false
    },
    {
      "evaluator": "acc_jerk_spec",
      "pattern": "acc_request_oscillation",
      "technical_domain": "ACC",
      "observation": "observed",
      "evidence_class": "deidentified_derived_observation",
      "causal_conclusion": false
    },
    {
      "evaluator": "acc_heavy_decel_spec",
      "pattern": "acc_actual_decel_vs_ooi",
      "technical_domain": "ACC",
      "observation": "observed",
      "evidence_class": "deidentified_derived_observation",
      "causal_conclusion": false
    },
    {
      "evaluator": "acc_abnormal_exit_spec",
      "pattern": null,
      "technical_domain": "ACC",
      "observation": "not_observed",
      "evidence_class": "deidentified_derived_observation",
      "causal_conclusion": false
    },
    {
      "evaluator": "acc_ooi_target_switch_cut_in",
      "pattern": null,
      "technical_domain": "ACC",
      "observation": "not_observed",
      "evidence_class": "deidentified_derived_observation",
      "causal_conclusion": false
    },
    {
      "evaluator": "acc_dai_reminder",
      "pattern": null,
      "technical_domain": "ACC",
      "observation": "not_observed",
      "evidence_class": "deidentified_derived_observation",
      "causal_conclusion": false
    },
    {
      "evaluator": "object_track_quality",
      "pattern": null,
      "technical_domain": "PERCEPTION_OBJECT",
      "observation": "insufficient_fields",
      "evidence_class": "deidentified_derived_observation",
      "causal_conclusion": false
    }
  ],
  "hypotheses": [
    {
      "technical_domain": "PERCEPTION_OBJECT",
      "status": "candidate_only",
      "causal_attribution": false,
      "related_observations": [
        "object_kinematics_consistency",
        "object_track_quality"
      ]
    },
    {
      "technical_domain": "CONTROL_LONGITUDINAL",
      "status": "candidate_only",
      "causal_attribution": false,
      "related_observations": [
        "ego_longitudinal_oscillation"
      ]
    },
    {
      "technical_domain": "ACC",
      "status": "candidate_only",
      "causal_attribution": false,
      "related_observations": [
        "acc_jerk_spec",
        "acc_heavy_decel_spec",
        "acc_abnormal_exit_spec",
        "acc_ooi_target_switch_cut_in",
        "acc_dai_reminder"
      ]
    }
  ],
  "decision": {
    "epistemic_state": "insufficient_evidence",
    "publication_terminal_class": "insufficient_evidence",
    "conclusion": "No causal attribution is admissible from the distributed fixture alone.",
    "confidence": 1,
    "stop_reason": "Raw evidence and independent adjudication are not distributed.",
    "next_action": "Obtain the raw aligned signal slice and attachment evidence, then have an independent engineer adjudicate the terminal class and causal direction."
  },
  "report": {
    "headline": "RCA-EXT-001: evidence boundary reached",
    "summary": "The reported phenomenon is preserved as intake context, and 8 derived factual checks are available. These observations do not establish a causal root cause.",
    "evidence": [
      "object_kinematics_consistency:observed",
      "ego_longitudinal_oscillation:observed",
      "acc_jerk_spec:observed",
      "acc_heavy_decel_spec:observed",
      "acc_abnormal_exit_spec:not_observed",
      "acc_ooi_target_switch_cut_in:not_observed",
      "acc_dai_reminder:not_observed",
      "object_track_quality:insufficient_fields"
    ],
    "boundary": [
      "raw MCAP signal slice",
      "attachment bodies or independently reviewed frame annotations",
      "private gold terminal label and causal graph",
      "higher-confidence time and entity alignment"
    ],
    "next_action": "Obtain the raw aligned signal slice and attachment evidence, then have an independent engineer adjudicate the terminal class and causal direction."
  }
}
