{
  "schema_version": "rca-assessment/answer/v1",
  "case_id": "RCA-EXT-008",
  "issue_focus": {
    "domain": "LCC",
    "phenomena": [
      "跟随前车，双线变成单线车道，未延单线控车，撞向护栏"
    ],
    "target_roles": [],
    "required_capabilities": [
      "lane.left.curvature",
      "lane.right.curvature",
      "lane.coefficients",
      "lane.branch_or_intersection_state",
      "lane.confidence",
      "ego.lateral_position",
      "lcc.lateral_command",
      "frame_id"
    ],
    "required_segments": [
      "intake_description",
      "decoded_case_metadata",
      "raw_signal_slice",
      "attachment_evidence"
    ]
  },
  "data_assessment": {
    "status": "insufficient_evidence",
    "relevant_topics": [
      "vehicle_can",
      "debug_can",
      "control_debug",
      "object_perception",
      "hmi_objects",
      "vision_objects",
      "vision_warning",
      "object_collection",
      "vehicle_signal_highfreq",
      "vehicle_signal_lowfreq",
      "planning_environment",
      "lane_2d",
      "lane_bev",
      "lane_sr",
      "lane_hmi",
      "road_marking",
      "localization_gnss"
    ],
    "missing_requirements": [
      "raw MCAP signal slice",
      "attachment bodies or independently reviewed frame annotations",
      "private gold terminal label and causal graph",
      "adjudicated issue anchor",
      "sufficient function-domain decoded fields",
      "higher-confidence time and entity alignment"
    ],
    "evidence_boundary": "The fixture contains de-identified case metadata and derived factual-check observations. It contains no raw MCAP slice, attachment body, private gold label, or independently reviewed causal conclusion."
  },
  "alignment": {
    "anchor": {
      "status": "unavailable",
      "alignment": "unknown"
    },
    "windows": [
      {
        "kind": "factual_check_window",
        "check": "lane_geometry_quality",
        "start_s": -3,
        "end_s": 1
      },
      {
        "kind": "factual_check_window",
        "check": "lane_perception_lane2d_j2_deviation",
        "start_s": 0,
        "end_s": 5
      },
      {
        "kind": "factual_check_window",
        "check": "lcc_exit",
        "start_s": 0,
        "end_s": 2
      },
      {
        "kind": "factual_check_window",
        "check": "lcc_weaving",
        "start_s": 0,
        "end_s": 2
      },
      {
        "kind": "factual_check_window",
        "check": "lane_perception_lane1_lane2_jump",
        "start_s": 0,
        "end_s": 2
      },
      {
        "kind": "factual_check_window",
        "check": "lane2d_j2_alignment_error",
        "start_s": 0,
        "end_s": 2
      },
      {
        "kind": "factual_check_window",
        "check": "dnp_spp_lane_center_delta",
        "start_s": -5,
        "end_s": 2
      },
      {
        "kind": "factual_check_window",
        "check": "dnp_spp_temporal_jump",
        "start_s": -5,
        "end_s": 2
      },
      {
        "kind": "provided_focus_window",
        "start_s": -5.35,
        "end_s": -1.35
      }
    ],
    "entity_bindings": [
      {
        "status": "not_adjudicated",
        "available_alias_signals": []
      }
    ]
  },
  "measurements": [
    {
      "name": "lane_geometry_quality",
      "observation": "observed",
      "window_s": [
        -3,
        1
      ],
      "numeric_value_available": false,
      "source": "factual_check_observations"
    },
    {
      "name": "lane_perception_lane2d_j2_deviation",
      "observation": "observed",
      "window_s": [
        0,
        5
      ],
      "numeric_value_available": false,
      "source": "factual_check_observations"
    },
    {
      "name": "lcc_exit",
      "observation": "insufficient_fields",
      "window_s": [
        0,
        2
      ],
      "numeric_value_available": false,
      "source": "factual_check_observations"
    },
    {
      "name": "lcc_weaving",
      "observation": "insufficient_fields",
      "window_s": [
        0,
        2
      ],
      "numeric_value_available": false,
      "source": "factual_check_observations"
    },
    {
      "name": "lane_perception_lane1_lane2_jump",
      "observation": "insufficient_fields",
      "window_s": [
        0,
        2
      ],
      "numeric_value_available": false,
      "source": "factual_check_observations"
    },
    {
      "name": "lane2d_j2_alignment_error",
      "observation": "insufficient_fields",
      "window_s": [
        0,
        2
      ],
      "numeric_value_available": false,
      "source": "factual_check_observations"
    },
    {
      "name": "dnp_spp_lane_center_delta",
      "observation": "insufficient_fields",
      "window_s": [
        -5,
        2
      ],
      "numeric_value_available": false,
      "source": "factual_check_observations"
    },
    {
      "name": "dnp_spp_temporal_jump",
      "observation": "insufficient_fields",
      "window_s": [
        -5,
        2
      ],
      "numeric_value_available": false,
      "source": "factual_check_observations"
    }
  ],
  "evaluator_results": [
    {
      "evaluator": "lane_geometry_quality",
      "pattern": "lane_geometry_anomaly",
      "technical_domain": "PERCEPTION_LANE",
      "observation": "observed",
      "evidence_class": "deidentified_derived_observation",
      "causal_conclusion": false
    },
    {
      "evaluator": "lane_perception_lane2d_j2_deviation",
      "pattern": "lane2d_j2_or_temporal_abnormal",
      "technical_domain": "LANE_PERCEPTION",
      "observation": "observed",
      "evidence_class": "deidentified_derived_observation",
      "causal_conclusion": false
    },
    {
      "evaluator": "lcc_exit",
      "pattern": null,
      "technical_domain": "LCC",
      "observation": "insufficient_fields",
      "evidence_class": "deidentified_derived_observation",
      "causal_conclusion": false
    },
    {
      "evaluator": "lcc_weaving",
      "pattern": null,
      "technical_domain": "LCC",
      "observation": "insufficient_fields",
      "evidence_class": "deidentified_derived_observation",
      "causal_conclusion": false
    },
    {
      "evaluator": "lane_perception_lane1_lane2_jump",
      "pattern": null,
      "technical_domain": "LCC",
      "observation": "insufficient_fields",
      "evidence_class": "deidentified_derived_observation",
      "causal_conclusion": false
    },
    {
      "evaluator": "lane2d_j2_alignment_error",
      "pattern": null,
      "technical_domain": "LANE_PERCEPTION",
      "observation": "insufficient_fields",
      "evidence_class": "deidentified_derived_observation",
      "causal_conclusion": false
    },
    {
      "evaluator": "dnp_spp_lane_center_delta",
      "pattern": null,
      "technical_domain": "DNP_SPP",
      "observation": "insufficient_fields",
      "evidence_class": "deidentified_derived_observation",
      "causal_conclusion": false
    },
    {
      "evaluator": "dnp_spp_temporal_jump",
      "pattern": null,
      "technical_domain": "DNP_SPP",
      "observation": "insufficient_fields",
      "evidence_class": "deidentified_derived_observation",
      "causal_conclusion": false
    }
  ],
  "hypotheses": [
    {
      "technical_domain": "PERCEPTION_LANE",
      "status": "candidate_only",
      "causal_attribution": false,
      "related_observations": [
        "lane_geometry_quality"
      ]
    },
    {
      "technical_domain": "LANE_PERCEPTION",
      "status": "candidate_only",
      "causal_attribution": false,
      "related_observations": [
        "lane_perception_lane2d_j2_deviation",
        "lane2d_j2_alignment_error"
      ]
    },
    {
      "technical_domain": "LCC",
      "status": "candidate_only",
      "causal_attribution": false,
      "related_observations": [
        "lcc_exit",
        "lcc_weaving",
        "lane_perception_lane1_lane2_jump"
      ]
    },
    {
      "technical_domain": "DNP_SPP",
      "status": "candidate_only",
      "causal_attribution": false,
      "related_observations": [
        "dnp_spp_lane_center_delta",
        "dnp_spp_temporal_jump"
      ]
    }
  ],
  "decision": {
    "epistemic_state": "insufficient_evidence",
    "publication_terminal_class": "insufficient_evidence",
    "conclusion": "No causal attribution is admissible from the distributed fixture alone.",
    "confidence": 1,
    "stop_reason": "Raw evidence and independent adjudication are not distributed.",
    "next_action": "Obtain the raw aligned signal slice and attachment evidence, then have an independent engineer adjudicate the terminal class and causal direction."
  },
  "report": {
    "headline": "RCA-EXT-008: evidence boundary reached",
    "summary": "The reported phenomenon is preserved as intake context, and 8 derived factual checks are available. These observations do not establish a causal root cause.",
    "evidence": [
      "lane_geometry_quality:observed",
      "lane_perception_lane2d_j2_deviation:observed",
      "lcc_exit:insufficient_fields",
      "lcc_weaving:insufficient_fields",
      "lane_perception_lane1_lane2_jump:insufficient_fields",
      "lane2d_j2_alignment_error:insufficient_fields",
      "dnp_spp_lane_center_delta:insufficient_fields",
      "dnp_spp_temporal_jump:insufficient_fields"
    ],
    "boundary": [
      "raw MCAP signal slice",
      "attachment bodies or independently reviewed frame annotations",
      "private gold terminal label and causal graph",
      "adjudicated issue anchor",
      "sufficient function-domain decoded fields",
      "higher-confidence time and entity alignment"
    ],
    "next_action": "Obtain the raw aligned signal slice and attachment evidence, then have an independent engineer adjudicate the terminal class and causal direction."
  }
}
