{
  "schema_version": "rca-assessment/answer/v1",
  "case_id": "RCA-EXT-010",
  "issue_focus": {
    "domain": "ACC",
    "phenomena": [
      "ACC拥堵跟车场景，前车缓慢刹停，自车靠近前车，减速顿错感强，车辆明显点头"
    ],
    "target_roles": [
      "target.speed",
      "target.range",
      "target_alias"
    ],
    "required_capabilities": [
      "ego.speed",
      "ego.actual_accel",
      "target.speed",
      "target.range",
      "controller.request_accel",
      "brake.open_loop_request",
      "actuator.response_delay",
      "acc.mode",
      "frame_id",
      "target_alias"
    ],
    "required_segments": [
      "intake_description",
      "decoded_case_metadata",
      "raw_signal_slice",
      "attachment_evidence"
    ]
  },
  "data_assessment": {
    "status": "insufficient_evidence",
    "relevant_topics": [
      "vehicle_can",
      "debug_can",
      "control_debug",
      "object_perception",
      "hmi_objects",
      "vision_objects",
      "vision_warning",
      "object_collection",
      "vehicle_signal_highfreq",
      "vehicle_signal_lowfreq",
      "planning_environment",
      "lane_2d",
      "lane_bev",
      "lane_sr",
      "lane_hmi",
      "road_marking",
      "localization_gnss"
    ],
    "missing_requirements": [
      "raw MCAP signal slice",
      "attachment bodies or independently reviewed frame annotations",
      "private gold terminal label and causal graph",
      "adjudicated issue anchor",
      "sufficient function-domain decoded fields",
      "higher-confidence time and entity alignment"
    ],
    "evidence_boundary": "The fixture contains de-identified case metadata and derived factual-check observations. It contains no raw MCAP slice, attachment body, private gold label, or independently reviewed causal conclusion."
  },
  "alignment": {
    "anchor": {
      "status": "unavailable",
      "alignment": "unknown"
    },
    "windows": [
      {
        "kind": "factual_check_window",
        "check": "object_kinematics_consistency",
        "start_s": -3,
        "end_s": 1
      },
      {
        "kind": "factual_check_window",
        "check": "object_track_quality",
        "start_s": -3,
        "end_s": 1
      },
      {
        "kind": "factual_check_window",
        "check": "ego_longitudinal_oscillation",
        "start_s": -5,
        "end_s": 2
      },
      {
        "kind": "factual_check_window",
        "check": "acc_heavy_decel_spec",
        "start_s": -5,
        "end_s": 2
      },
      {
        "kind": "factual_check_window",
        "check": "op_target_range_jitter",
        "start_s": -3,
        "end_s": 1
      },
      {
        "kind": "factual_check_window",
        "check": "cipv_target_selection",
        "start_s": -4,
        "end_s": 1
      },
      {
        "kind": "factual_check_window",
        "check": "acc_abnormal_exit_spec",
        "start_s": -5,
        "end_s": 2
      },
      {
        "kind": "factual_check_window",
        "check": "acc_jerk_spec",
        "start_s": -5,
        "end_s": 2
      },
      {
        "kind": "provided_focus_window",
        "start_s": -4.9,
        "end_s": -0.9
      }
    ],
    "entity_bindings": [
      {
        "status": "not_adjudicated",
        "available_alias_signals": [
          "target_alias"
        ]
      }
    ]
  },
  "measurements": [
    {
      "name": "object_kinematics_consistency",
      "observation": "observed",
      "window_s": [
        -3,
        1
      ],
      "numeric_value_available": false,
      "source": "factual_check_observations"
    },
    {
      "name": "object_track_quality",
      "observation": "observed",
      "window_s": [
        -3,
        1
      ],
      "numeric_value_available": false,
      "source": "factual_check_observations"
    },
    {
      "name": "ego_longitudinal_oscillation",
      "observation": "observed",
      "window_s": [
        -5,
        2
      ],
      "numeric_value_available": false,
      "source": "factual_check_observations"
    },
    {
      "name": "acc_heavy_decel_spec",
      "observation": "observed",
      "window_s": [
        -5,
        2
      ],
      "numeric_value_available": false,
      "source": "factual_check_observations"
    },
    {
      "name": "op_target_range_jitter",
      "observation": "observed",
      "window_s": [
        -3,
        1
      ],
      "numeric_value_available": false,
      "source": "factual_check_observations"
    },
    {
      "name": "cipv_target_selection",
      "observation": "not_observed",
      "window_s": [
        -4,
        1
      ],
      "numeric_value_available": false,
      "source": "factual_check_observations"
    },
    {
      "name": "acc_abnormal_exit_spec",
      "observation": "not_observed",
      "window_s": [
        -5,
        2
      ],
      "numeric_value_available": false,
      "source": "factual_check_observations"
    },
    {
      "name": "acc_jerk_spec",
      "observation": "not_observed",
      "window_s": [
        -5,
        2
      ],
      "numeric_value_available": false,
      "source": "factual_check_observations"
    }
  ],
  "evaluator_results": [
    {
      "evaluator": "object_kinematics_consistency",
      "pattern": "perception_object_kinematics_anomaly",
      "technical_domain": "PERCEPTION_OBJECT",
      "observation": "observed",
      "evidence_class": "deidentified_derived_observation",
      "causal_conclusion": false
    },
    {
      "evaluator": "object_track_quality",
      "pattern": "perception_track_quality_anomaly",
      "technical_domain": "PERCEPTION_OBJECT",
      "observation": "observed",
      "evidence_class": "deidentified_derived_observation",
      "causal_conclusion": false
    },
    {
      "evaluator": "ego_longitudinal_oscillation",
      "pattern": "ego_longitudinal_oscillation",
      "technical_domain": "CONTROL_LONGITUDINAL",
      "observation": "observed",
      "evidence_class": "deidentified_derived_observation",
      "causal_conclusion": false
    },
    {
      "evaluator": "acc_heavy_decel_spec",
      "pattern": "acc_actual_decel_vs_ooi",
      "technical_domain": "ACC",
      "observation": "observed",
      "evidence_class": "deidentified_derived_observation",
      "causal_conclusion": false
    },
    {
      "evaluator": "op_target_range_jitter",
      "pattern": "op_range_measurement_jitter",
      "technical_domain": "PERCEPTION_OBJECT",
      "observation": "observed",
      "evidence_class": "deidentified_derived_observation",
      "causal_conclusion": false
    },
    {
      "evaluator": "cipv_target_selection",
      "pattern": null,
      "technical_domain": "PERCEPTION_OBJECT",
      "observation": "not_observed",
      "evidence_class": "deidentified_derived_observation",
      "causal_conclusion": false
    },
    {
      "evaluator": "acc_abnormal_exit_spec",
      "pattern": null,
      "technical_domain": "ACC",
      "observation": "not_observed",
      "evidence_class": "deidentified_derived_observation",
      "causal_conclusion": false
    },
    {
      "evaluator": "acc_jerk_spec",
      "pattern": null,
      "technical_domain": "ACC",
      "observation": "not_observed",
      "evidence_class": "deidentified_derived_observation",
      "causal_conclusion": false
    }
  ],
  "hypotheses": [
    {
      "technical_domain": "PERCEPTION_OBJECT",
      "status": "candidate_only",
      "causal_attribution": false,
      "related_observations": [
        "object_kinematics_consistency",
        "object_track_quality",
        "op_target_range_jitter",
        "cipv_target_selection"
      ]
    },
    {
      "technical_domain": "CONTROL_LONGITUDINAL",
      "status": "candidate_only",
      "causal_attribution": false,
      "related_observations": [
        "ego_longitudinal_oscillation"
      ]
    },
    {
      "technical_domain": "ACC",
      "status": "candidate_only",
      "causal_attribution": false,
      "related_observations": [
        "acc_heavy_decel_spec",
        "acc_abnormal_exit_spec",
        "acc_jerk_spec"
      ]
    }
  ],
  "decision": {
    "epistemic_state": "insufficient_evidence",
    "publication_terminal_class": "insufficient_evidence",
    "conclusion": "No causal attribution is admissible from the distributed fixture alone.",
    "confidence": 1,
    "stop_reason": "Raw evidence and independent adjudication are not distributed.",
    "next_action": "Obtain the raw aligned signal slice and attachment evidence, then have an independent engineer adjudicate the terminal class and causal direction."
  },
  "report": {
    "headline": "RCA-EXT-010: evidence boundary reached",
    "summary": "The reported phenomenon is preserved as intake context, and 8 derived factual checks are available. These observations do not establish a causal root cause.",
    "evidence": [
      "object_kinematics_consistency:observed",
      "object_track_quality:observed",
      "ego_longitudinal_oscillation:observed",
      "acc_heavy_decel_spec:observed",
      "op_target_range_jitter:observed",
      "cipv_target_selection:not_observed",
      "acc_abnormal_exit_spec:not_observed",
      "acc_jerk_spec:not_observed"
    ],
    "boundary": [
      "raw MCAP signal slice",
      "attachment bodies or independently reviewed frame annotations",
      "private gold terminal label and causal graph",
      "adjudicated issue anchor",
      "sufficient function-domain decoded fields",
      "higher-confidence time and entity alignment"
    ],
    "next_action": "Obtain the raw aligned signal slice and attachment evidence, then have an independent engineer adjudicate the terminal class and causal direction."
  }
}
