{
  "schema_version": "rca-assessment/answer/v1",
  "case_id": "RCA-EXT-002",
  "issue_focus": {
    "domain": "FCW",
    "phenomena": [
      "自车直行遇到远处弯道临停小车-FCW误触发"
    ],
    "target_roles": [
      "target.range",
      "target.relative_speed",
      "target.stationary_state",
      "target.in_path_geometry",
      "target_alias"
    ],
    "required_capabilities": [
      "ego.speed",
      "ego.steering",
      "target.range",
      "target.relative_speed",
      "target.stationary_state",
      "target.in_path_geometry",
      "fcw.ttc",
      "fcw.trigger_state",
      "frame_id",
      "target_alias"
    ],
    "required_segments": [
      "intake_description",
      "decoded_case_metadata",
      "raw_signal_slice",
      "attachment_evidence"
    ]
  },
  "data_assessment": {
    "status": "insufficient_evidence",
    "relevant_topics": [
      "vehicle_can",
      "debug_can",
      "control_debug",
      "object_perception",
      "hmi_objects",
      "vision_objects",
      "vision_warning",
      "object_collection",
      "vehicle_signal_highfreq",
      "vehicle_signal_lowfreq",
      "planning_environment",
      "lane_2d",
      "lane_bev",
      "lane_sr",
      "lane_hmi",
      "road_marking",
      "localization_gnss"
    ],
    "missing_requirements": [
      "raw MCAP signal slice",
      "attachment bodies or independently reviewed frame annotations",
      "private gold terminal label and causal graph",
      "higher-confidence time and entity alignment"
    ],
    "evidence_boundary": "The fixture contains de-identified case metadata and derived factual-check observations. It contains no raw MCAP slice, attachment body, private gold label, or independently reviewed causal conclusion."
  },
  "alignment": {
    "anchor": {
      "status": "provided",
      "time_s": 8.4,
      "alignment": "exact_match"
    },
    "windows": [
      {
        "kind": "factual_check_window",
        "check": "lane_geometry_quality",
        "start_s": -3,
        "end_s": 1
      },
      {
        "kind": "factual_check_window",
        "check": "ego_longitudinal_oscillation",
        "start_s": -5,
        "end_s": 2
      },
      {
        "kind": "factual_check_window",
        "check": "object_kinematics_consistency",
        "start_s": -3,
        "end_s": 1
      },
      {
        "kind": "factual_check_window",
        "check": "object_track_quality",
        "start_s": -3,
        "end_s": 1
      },
      {
        "kind": "factual_check_window",
        "check": "cipv_target_selection",
        "start_s": -4,
        "end_s": 1
      },
      {
        "kind": "factual_check_window",
        "check": "aeb_confidence_or_range_speed_jump",
        "start_s": 5.4,
        "end_s": 9.4
      },
      {
        "kind": "factual_check_window",
        "check": "aeb_target_class_jump",
        "start_s": 5.4,
        "end_s": 9.4
      },
      {
        "kind": "factual_check_window",
        "check": "fcw_aeb_target_instability",
        "start_s": 5.4,
        "end_s": 9.4
      },
      {
        "kind": "provided_focus_window",
        "start_s": 5.4,
        "end_s": 9.4
      }
    ],
    "entity_bindings": [
      {
        "status": "not_adjudicated",
        "available_alias_signals": [
          "target_alias"
        ]
      }
    ]
  },
  "measurements": [
    {
      "name": "lane_geometry_quality",
      "observation": "observed",
      "window_s": [
        -3,
        1
      ],
      "numeric_value_available": false,
      "source": "factual_check_observations"
    },
    {
      "name": "ego_longitudinal_oscillation",
      "observation": "observed",
      "window_s": [
        -5,
        2
      ],
      "numeric_value_available": false,
      "source": "factual_check_observations"
    },
    {
      "name": "object_kinematics_consistency",
      "observation": "not_observed",
      "window_s": [
        -3,
        1
      ],
      "numeric_value_available": false,
      "source": "factual_check_observations"
    },
    {
      "name": "object_track_quality",
      "observation": "not_observed",
      "window_s": [
        -3,
        1
      ],
      "numeric_value_available": false,
      "source": "factual_check_observations"
    },
    {
      "name": "cipv_target_selection",
      "observation": "not_observed",
      "window_s": [
        -4,
        1
      ],
      "numeric_value_available": false,
      "source": "factual_check_observations"
    },
    {
      "name": "aeb_confidence_or_range_speed_jump",
      "observation": "not_observed",
      "window_s": [
        5.4,
        9.4
      ],
      "numeric_value_available": false,
      "source": "factual_check_observations"
    },
    {
      "name": "aeb_target_class_jump",
      "observation": "not_observed",
      "window_s": [
        5.4,
        9.4
      ],
      "numeric_value_available": false,
      "source": "factual_check_observations"
    },
    {
      "name": "fcw_aeb_target_instability",
      "observation": "insufficient_fields",
      "window_s": [
        5.4,
        9.4
      ],
      "numeric_value_available": false,
      "source": "factual_check_observations"
    }
  ],
  "evaluator_results": [
    {
      "evaluator": "lane_geometry_quality",
      "pattern": "lane_geometry_anomaly",
      "technical_domain": "PERCEPTION_LANE",
      "observation": "observed",
      "evidence_class": "deidentified_derived_observation",
      "causal_conclusion": false
    },
    {
      "evaluator": "ego_longitudinal_oscillation",
      "pattern": "ego_longitudinal_oscillation",
      "technical_domain": "CONTROL_LONGITUDINAL",
      "observation": "observed",
      "evidence_class": "deidentified_derived_observation",
      "causal_conclusion": false
    },
    {
      "evaluator": "object_kinematics_consistency",
      "pattern": null,
      "technical_domain": "PERCEPTION_OBJECT",
      "observation": "not_observed",
      "evidence_class": "deidentified_derived_observation",
      "causal_conclusion": false
    },
    {
      "evaluator": "object_track_quality",
      "pattern": null,
      "technical_domain": "PERCEPTION_OBJECT",
      "observation": "not_observed",
      "evidence_class": "deidentified_derived_observation",
      "causal_conclusion": false
    },
    {
      "evaluator": "cipv_target_selection",
      "pattern": null,
      "technical_domain": "PERCEPTION_OBJECT",
      "observation": "not_observed",
      "evidence_class": "deidentified_derived_observation",
      "causal_conclusion": false
    },
    {
      "evaluator": "aeb_confidence_or_range_speed_jump",
      "pattern": null,
      "technical_domain": "AEB_FCW",
      "observation": "not_observed",
      "evidence_class": "deidentified_derived_observation",
      "causal_conclusion": false
    },
    {
      "evaluator": "aeb_target_class_jump",
      "pattern": null,
      "technical_domain": "AEB_FCW",
      "observation": "not_observed",
      "evidence_class": "deidentified_derived_observation",
      "causal_conclusion": false
    },
    {
      "evaluator": "fcw_aeb_target_instability",
      "pattern": null,
      "technical_domain": "AEB_FCW",
      "observation": "insufficient_fields",
      "evidence_class": "deidentified_derived_observation",
      "causal_conclusion": false
    }
  ],
  "hypotheses": [
    {
      "technical_domain": "PERCEPTION_LANE",
      "status": "candidate_only",
      "causal_attribution": false,
      "related_observations": [
        "lane_geometry_quality"
      ]
    },
    {
      "technical_domain": "CONTROL_LONGITUDINAL",
      "status": "candidate_only",
      "causal_attribution": false,
      "related_observations": [
        "ego_longitudinal_oscillation"
      ]
    },
    {
      "technical_domain": "PERCEPTION_OBJECT",
      "status": "candidate_only",
      "causal_attribution": false,
      "related_observations": [
        "object_kinematics_consistency",
        "object_track_quality",
        "cipv_target_selection"
      ]
    },
    {
      "technical_domain": "AEB_FCW",
      "status": "candidate_only",
      "causal_attribution": false,
      "related_observations": [
        "aeb_confidence_or_range_speed_jump",
        "aeb_target_class_jump",
        "fcw_aeb_target_instability"
      ]
    }
  ],
  "decision": {
    "epistemic_state": "insufficient_evidence",
    "publication_terminal_class": "insufficient_evidence",
    "conclusion": "No causal attribution is admissible from the distributed fixture alone.",
    "confidence": 1,
    "stop_reason": "Raw evidence and independent adjudication are not distributed.",
    "next_action": "Obtain the raw aligned signal slice and attachment evidence, then have an independent engineer adjudicate the terminal class and causal direction."
  },
  "report": {
    "headline": "RCA-EXT-002: evidence boundary reached",
    "summary": "The reported phenomenon is preserved as intake context, and 8 derived factual checks are available. These observations do not establish a causal root cause.",
    "evidence": [
      "lane_geometry_quality:observed",
      "ego_longitudinal_oscillation:observed",
      "object_kinematics_consistency:not_observed",
      "object_track_quality:not_observed",
      "cipv_target_selection:not_observed",
      "aeb_confidence_or_range_speed_jump:not_observed",
      "aeb_target_class_jump:not_observed",
      "fcw_aeb_target_instability:insufficient_fields"
    ],
    "boundary": [
      "raw MCAP signal slice",
      "attachment bodies or independently reviewed frame annotations",
      "private gold terminal label and causal graph",
      "higher-confidence time and entity alignment"
    ],
    "next_action": "Obtain the raw aligned signal slice and attachment evidence, then have an independent engineer adjudicate the terminal class and causal direction."
  }
}
