{
  "schema_version": "rca-assessment/answer/v1",
  "case_id": "RCA-EXT-007",
  "issue_focus": {
    "domain": "AWB",
    "phenomena": [
      "[PROJECT_OR_BUILD_REDACTED][LOCATION_REDACTED]-晴天山区正常行驶前方三轮车距离较远误触发"
    ],
    "target_roles": [
      "target.range",
      "target.relative_speed",
      "target.absolute_speed",
      "target.class",
      "target.track_alias"
    ],
    "required_capabilities": [
      "target.range",
      "target.relative_speed",
      "target.absolute_speed",
      "target.class",
      "target.track_alias",
      "detector.confidence",
      "awb.trigger_state",
      "reference_range",
      "frame_id"
    ],
    "required_segments": [
      "intake_description",
      "decoded_case_metadata",
      "raw_signal_slice",
      "attachment_evidence"
    ]
  },
  "data_assessment": {
    "status": "insufficient_evidence",
    "relevant_topics": [
      "vehicle_can",
      "debug_can",
      "control_debug",
      "object_perception",
      "hmi_objects",
      "vision_objects",
      "vision_warning",
      "object_collection",
      "vehicle_signal_highfreq",
      "vehicle_signal_lowfreq",
      "planning_environment",
      "lane_2d",
      "lane_bev",
      "lane_sr",
      "lane_hmi",
      "road_marking",
      "localization_gnss"
    ],
    "missing_requirements": [
      "raw MCAP signal slice",
      "attachment bodies or independently reviewed frame annotations",
      "private gold terminal label and causal graph",
      "adjudicated issue anchor",
      "sufficient function-domain decoded fields",
      "higher-confidence time and entity alignment"
    ],
    "evidence_boundary": "The fixture contains de-identified case metadata and derived factual-check observations. It contains no raw MCAP slice, attachment body, private gold label, or independently reviewed causal conclusion."
  },
  "alignment": {
    "anchor": {
      "status": "unavailable",
      "alignment": "unknown"
    },
    "windows": [
      {
        "kind": "factual_check_window",
        "check": "object_kinematics_consistency",
        "start_s": -3,
        "end_s": 1
      },
      {
        "kind": "factual_check_window",
        "check": "object_track_quality",
        "start_s": -3,
        "end_s": 1
      },
      {
        "kind": "factual_check_window",
        "check": "op_target_range_jitter",
        "start_s": -3,
        "end_s": 1
      },
      {
        "kind": "factual_check_window",
        "check": "op_target_lateral_jitter",
        "start_s": -3,
        "end_s": 1
      },
      {
        "kind": "factual_check_window",
        "check": "lane_geometry_quality",
        "start_s": -3,
        "end_s": 1
      },
      {
        "kind": "factual_check_window",
        "check": "cipv_target_selection",
        "start_s": -4,
        "end_s": 1
      },
      {
        "kind": "factual_check_window",
        "check": "ego_longitudinal_oscillation",
        "start_s": -5,
        "end_s": 2
      },
      {
        "kind": "factual_check_window",
        "check": "op_target_velocity_jump",
        "start_s": -3,
        "end_s": 1
      },
      {
        "kind": "provided_focus_window",
        "start_s": -4.9,
        "end_s": -0.9
      }
    ],
    "entity_bindings": [
      {
        "status": "not_adjudicated",
        "available_alias_signals": [
          "target.track_alias"
        ]
      }
    ]
  },
  "measurements": [
    {
      "name": "object_kinematics_consistency",
      "observation": "observed",
      "window_s": [
        -3,
        1
      ],
      "numeric_value_available": false,
      "source": "factual_check_observations"
    },
    {
      "name": "object_track_quality",
      "observation": "observed",
      "window_s": [
        -3,
        1
      ],
      "numeric_value_available": false,
      "source": "factual_check_observations"
    },
    {
      "name": "op_target_range_jitter",
      "observation": "observed",
      "window_s": [
        -3,
        1
      ],
      "numeric_value_available": false,
      "source": "factual_check_observations"
    },
    {
      "name": "op_target_lateral_jitter",
      "observation": "observed",
      "window_s": [
        -3,
        1
      ],
      "numeric_value_available": false,
      "source": "factual_check_observations"
    },
    {
      "name": "lane_geometry_quality",
      "observation": "not_observed",
      "window_s": [
        -3,
        1
      ],
      "numeric_value_available": false,
      "source": "factual_check_observations"
    },
    {
      "name": "cipv_target_selection",
      "observation": "not_observed",
      "window_s": [
        -4,
        1
      ],
      "numeric_value_available": false,
      "source": "factual_check_observations"
    },
    {
      "name": "ego_longitudinal_oscillation",
      "observation": "not_observed",
      "window_s": [
        -5,
        2
      ],
      "numeric_value_available": false,
      "source": "factual_check_observations"
    },
    {
      "name": "op_target_velocity_jump",
      "observation": "not_observed",
      "window_s": [
        -3,
        1
      ],
      "numeric_value_available": false,
      "source": "factual_check_observations"
    }
  ],
  "evaluator_results": [
    {
      "evaluator": "object_kinematics_consistency",
      "pattern": "perception_object_kinematics_anomaly",
      "technical_domain": "PERCEPTION_OBJECT",
      "observation": "observed",
      "evidence_class": "deidentified_derived_observation",
      "causal_conclusion": false
    },
    {
      "evaluator": "object_track_quality",
      "pattern": "perception_track_quality_anomaly",
      "technical_domain": "PERCEPTION_OBJECT",
      "observation": "observed",
      "evidence_class": "deidentified_derived_observation",
      "causal_conclusion": false
    },
    {
      "evaluator": "op_target_range_jitter",
      "pattern": "op_range_measurement_jitter",
      "technical_domain": "PERCEPTION_OBJECT",
      "observation": "observed",
      "evidence_class": "deidentified_derived_observation",
      "causal_conclusion": false
    },
    {
      "evaluator": "op_target_lateral_jitter",
      "pattern": "op_lateral_measurement_jitter",
      "technical_domain": "PERCEPTION_OBJECT",
      "observation": "observed",
      "evidence_class": "deidentified_derived_observation",
      "causal_conclusion": false
    },
    {
      "evaluator": "lane_geometry_quality",
      "pattern": null,
      "technical_domain": "PERCEPTION_LANE",
      "observation": "not_observed",
      "evidence_class": "deidentified_derived_observation",
      "causal_conclusion": false
    },
    {
      "evaluator": "cipv_target_selection",
      "pattern": null,
      "technical_domain": "PERCEPTION_OBJECT",
      "observation": "not_observed",
      "evidence_class": "deidentified_derived_observation",
      "causal_conclusion": false
    },
    {
      "evaluator": "ego_longitudinal_oscillation",
      "pattern": null,
      "technical_domain": "CONTROL_LONGITUDINAL",
      "observation": "not_observed",
      "evidence_class": "deidentified_derived_observation",
      "causal_conclusion": false
    },
    {
      "evaluator": "op_target_velocity_jump",
      "pattern": null,
      "technical_domain": "PERCEPTION_OBJECT",
      "observation": "not_observed",
      "evidence_class": "deidentified_derived_observation",
      "causal_conclusion": false
    }
  ],
  "hypotheses": [
    {
      "technical_domain": "PERCEPTION_OBJECT",
      "status": "candidate_only",
      "causal_attribution": false,
      "related_observations": [
        "object_kinematics_consistency",
        "object_track_quality",
        "op_target_range_jitter",
        "op_target_lateral_jitter",
        "cipv_target_selection",
        "op_target_velocity_jump"
      ]
    },
    {
      "technical_domain": "PERCEPTION_LANE",
      "status": "candidate_only",
      "causal_attribution": false,
      "related_observations": [
        "lane_geometry_quality"
      ]
    },
    {
      "technical_domain": "CONTROL_LONGITUDINAL",
      "status": "candidate_only",
      "causal_attribution": false,
      "related_observations": [
        "ego_longitudinal_oscillation"
      ]
    }
  ],
  "decision": {
    "epistemic_state": "insufficient_evidence",
    "publication_terminal_class": "insufficient_evidence",
    "conclusion": "No causal attribution is admissible from the distributed fixture alone.",
    "confidence": 1,
    "stop_reason": "Raw evidence and independent adjudication are not distributed.",
    "next_action": "Obtain the raw aligned signal slice and attachment evidence, then have an independent engineer adjudicate the terminal class and causal direction."
  },
  "report": {
    "headline": "RCA-EXT-007: evidence boundary reached",
    "summary": "The reported phenomenon is preserved as intake context, and 8 derived factual checks are available. These observations do not establish a causal root cause.",
    "evidence": [
      "object_kinematics_consistency:observed",
      "object_track_quality:observed",
      "op_target_range_jitter:observed",
      "op_target_lateral_jitter:observed",
      "lane_geometry_quality:not_observed",
      "cipv_target_selection:not_observed",
      "ego_longitudinal_oscillation:not_observed",
      "op_target_velocity_jump:not_observed"
    ],
    "boundary": [
      "raw MCAP signal slice",
      "attachment bodies or independently reviewed frame annotations",
      "private gold terminal label and causal graph",
      "adjudicated issue anchor",
      "sufficient function-domain decoded fields",
      "higher-confidence time and entity alignment"
    ],
    "next_action": "Obtain the raw aligned signal slice and attachment evidence, then have an independent engineer adjudicate the terminal class and causal direction."
  }
}
